<?xml version="1.0"  encoding="UTF-8"?>
<!DOCTYPE form-config SYSTEM "dynamic-form.dtd">
<form-config>
    <state-group>
        <state id="拟稿">
	        <component id="biaoti" renderType="normal" userId="" roleId="" deptId="" />
	        <component id="jhcd" renderType="normal" userId="" roleId="" deptId="" />
	        <component id="scbh" renderType="normal" userId="" roleId="" deptId="" />
            <component id="lxdh" renderType="normal" userId="" roleId="" deptId="" />
            <component id="beizhu" renderType="normal" userId="" roleId="" deptId="" />
            <component id="DRAFT_DEPT" 		renderType="normal" 	userId="" roleId="" deptId="" />
            <component id="all_Attachment" renderType="normal" userId="" roleId="" deptId="" />
            <component id="blyj_reason_list" renderType="normal" userId="" roleId="" deptId="" />
            <component id="file_list" renderType="normal" userId="" roleId="" deptId="" />
        </state>
        <state id="组审核">
        	<component id="biaoti" renderType="normal" userId="" roleId="" deptId="" />
	        <component id="jhcd" renderType="normal" userId="" roleId="" deptId="" />
	        <component id="scbh" renderType="normal" userId="" roleId="" deptId="" />
            <component id="lxdh" renderType="normal" userId="" roleId="" deptId="" />
            <component id="beizhu" renderType="normal" userId="" roleId="" deptId="" />
            <component id="DRAFT_DEPT" 		renderType="normal" 	userId="" roleId="" deptId="" />
            <component id="all_Attachment" renderType="normal" userId="" roleId="" deptId="" />
            <component id="blyj_reason_list" renderType="normal" userId="" roleId="" deptId="" />
            <component id="file_list" renderType="normal" userId="" roleId="" deptId="" />
        </state>
         <state id="readonly">
         	<component id="biaoti" renderType="normal" userId="" roleId="" deptId="" />
	        <component id="jhcd" renderType="normal" userId="" roleId="" deptId="" />
	        <component id="scbh" renderType="disable" userId="" roleId="" deptId="" />
            <component id="lxdh" renderType="normal" userId="" roleId="" deptId="" />
            <component id="beizhu" renderType="normal" userId="" roleId="" deptId="" />
            <component id="DRAFT_DEPT" 		renderType="normal" 	userId="" roleId="" deptId="" />
            <component id="all_Attachment" renderType="normal" userId="" roleId="" deptId="" />
            <component id="blyj_reason_list" renderType="normal" userId="" roleId="" deptId="" />
            <component id="file_list" renderType="normal" userId="" roleId="" deptId="" />
        </state>
    </state-group>
</form-config>
